,Title,Author(s),Rating,Rating_count,Review_count,No. of Pages,Format,Awards,Genres
858,The Inner Game of Tennis: The Classic Guide to the Mental Side of Peak Performance,"W. Timothy Gallwey, Pete Carroll, Zach Kleiman",4.18,25210.0,2192.0,134.0,Paperback,,"Nonfiction, Psychology, Sports, Self Help, Personal Development, Philosophy, Business"
859,"Game of Shadows: Barry Bonds, BALCO, and the Steroids Scandal that Rocked Professional Sports","Mark Fainaru-Wada, Lance Williams",3.83,5951.0,245.0,352.0,Hardcover,,"Sports, Baseball, Nonfiction, History, Journalism, Audiobook, Biography"
860,The City Game: Basketball from the Garden to the Playgrounds,Pete Axthelm,4.07,371.0,33.0,224.0,Library Binding,,"Sports, Basketball, Nonfiction"
861,Jim Cramer&apos;s Real Money: Sane Investing in an Insane World,James J. Cramer,3.69,2133.0,120.0,320.0,Hardcover,,"Finance, Nonfiction, Business, Money, Personal Finance, Economics, Audiobook"
862,"Jim Cramer&apos;s Mad Money: Watch TV, Get Rich","James J. Cramer, Cliff Mason",3.51,847.0,64.0,240.0,Hardcover,,"Business, Nonfiction, Finance, Personal Finance, Money, Economics"
863,Trading With the Enemy: Seduction and Betrayal on Jim Cramer&apos;s Wall Street,"Nicholas W. Maier, Josh Fund",3.74,96.0,8.0,208.0,Hardcover,,Nonfiction
864,The Forewarned Investor: Don&apos;t Get Fooled Again by Corporate Fraud,"Brett S. Messing, Steven A. Sugarman, Jim Cramer",3.33,6.0,,221.0,Hardcover,,
865,"Rich Dad, Poor Dad","Robert T. Kiyosaki, Sharon L. Lechter",4.1,689182.0,26066.0,204.0,Hardcover,Audie Award Business Information (2001),"Finance, Business, Nonfiction, Self Help, Money, Personal Finance, Personal Development"
866,Rich Dad Poor Dad Classics - Boxed Set,"Robert T. Kiyosaki, Sharon L. Lechter",4.1,689182.0,26066.0,0.0,Audio Cassette,Audie Award Business Information (2001),"Finance, Business, Nonfiction, Self Help, Money, Personal Finance, Personal Development"
867,"Rich Dad, Poor Dad 2 : Cash Flow Quadrant - Rich Dad&apos;s Guide to Financial Freedom","Robert T. Kiyosaki, Sharon L. Lechter",4.16,62559.0,1962.0,320.0,Paperback,,"Business, Finance, Nonfiction, Self Help, Money, Personal Finance, Personal Development"
868,"A Lonely Resurrection (John Rain, #2)",Barry Eisler,4.13,10278.0,475.0,352.0,Kindle Edition,Gumshoe Award Best Novel (2004),"Thriller, Fiction, Mystery, Action, Audiobook, Crime, Japan"
869,...and a Hard Rain Fell: A GI&apos;s True Story of the War in Vietnam,John Ketwig,4.12,966.0,89.0,400.0,Paperback,,"History, Nonfiction, War, Military Fiction, Military History, Memoir, Biography"
870,Hard Rain: A Dylan Commentary,Tim Riley,3.47,51.0,8.0,368.0,Paperback,,"Music, Poetry"
871,Hard Rain (Amsterdam Cops),Janwillem van de Wetering,3.92,284.0,17.0,320.0,Paperback,,"Mystery, Fiction, Crime, 20th Century, Suspense, Mystery Thriller, Detective"
872,Hard Rain,Peter Abrahams,3.78,205.0,20.0,352.0,Mass Market Paperback,,"Mystery, Fiction, Suspense, Thriller, Mystery Thriller"
873,Hard Rain: History of the Browning Machine Guns,Frank Iannamico,5.0,1.0,,338.0,Unknown Binding,,
874,Hard Rain: Our Headlong Collision with Nature,"Mark Ryall Edwards, Lloyd Timberlake, Bob Dylan",4.06,18.0,2.0,128.0,Paperback,,"Poetry, Nonfiction, Photography, Music"
875,Hard Rain,Matthew W. Mallen,4.0,2.0,,37.0,Unknown Binding,,
876,Hard Rain (Code Red #16),Darlene Scalera,4.41,39.0,2.0,250.0,Mass Market Paperback,,Harlequin
877,"A Clean Kill in Tokyo (John Rain, #1)",Barry Eisler,3.99,19104.0,1090.0,363.0,Kindle Edition,Gumshoe Award Best First Novel (2003),"Thriller, Fiction, Mystery, Crime, Mystery Thriller, Action, Audiobook"
878,When the Rain Falls (Whatever the Weather),Mary Lonsdale,3.6,10.0,1.0,12.0,Board book,,
879,The Rain Falls Like Rain,David Helwig,5.0,1.0,,204.0,Paperback,,
880,The Rain Falls Like Rain: Poems,David Helwig,5.0,1.0,,204.0,Unknown Binding,,
881,Memoirs of a Geisha,Arthur Golden,4.16,2075355.0,38180.0,503.0,Mass Market Paperback,,"Fiction, Historical Fiction, Romance, Classics, Historical, Japan, Book Club"
882,Memoirs of a Geisha,Arthur Golden,4.16,2075355.0,38180.0,434.0,Hardcover,,"Fiction, Historical Fiction, Romance, Classics, Historical, Japan, Book Club"
883,Memoirs of a Geisha,Arthur Golden,4.16,2075355.0,38180.0,497.0,Paperback,,"Fiction, Historical Fiction, Romance, Classics, Historical, Japan, Book Club"
884,Memoirs of a Geisha: Portrait of the Film,"David        James, Peggy Mulloy, Rob Marshall, Arthur Golden",4.17,173.0,12.0,144.0,Hardcover,,"Nonfiction, Art"
885,Memoirs of a Geisha,Arthur Golden,4.16,2075355.0,38180.0,434.0,Paperback,,"Fiction, Historical Fiction, Romance, Classics, Historical, Japan, Book Club"
886,Geisha of Gion,"Mineko Iwasaki, Rande Brown",3.93,26625.0,1837.0,334.0,Paperback,,"Nonfiction, Japan, Biography, Memoir, History, Asia, Autobiography"
887,Memoirs of a Geisha,"Arthur Golden, Elaina Erika Davis",4.16,2075355.0,38180.0,3.0,Audio CD,,"Fiction, Historical Fiction, Romance, Classics, Historical, Japan, Book Club"
888,Memoirs of a Geisha,Arthur Golden,4.16,2075355.0,38180.0,768.0,Paperback,,"Fiction, Historical Fiction, Romance, Classics, Historical, Japan, Book Club"
889,How to Make Anyone Fall in Love with You,Leil Lowndes,3.55,1407.0,111.0,336.0,Paperback,,"Self Help, Nonfiction, Relationships, Psychology, Love, Romance, Personal Development"
890,How To Get Laid: The Rules On How To Succeed With Women And How To Make Anyone Fall In Love With You,Michael James,3.0,2.0,,222.0,Paperback,,
891,Self-Help Pak: Love Tactics/How to Make Anyone Fall in Love with You,Thomas W. McKnight,5.0,1.0,,0.0,Unbound,,
892,Love As A Foreign Language #5,"J. Torres, Eric Kim",3.67,12.0,2.0,64.0,Paperback,,"Manga, Graphic Novels, Comics"
893,Los 5 lenguajes del amor de los niños,"Gary Chapman, D. Ross Campbell",4.17,28391.0,2520.0,252.0,Paperback,,"Parenting, Nonfiction, Self Help, Psychology, Christian, Relationships, Family"
894,Marriage Special Package- 2 books- Five Love Languages/Fight Fair,"Gary Chapman, Tim Downs, Joy Downs",4.32,41.0,10.0,400.0,Paperback,,
895,Jungle Love,Margaret Johnson,3.33,92.0,9.0,96.0,Paperback,,Romance
896,Jungle Love,"Margaret Johnson, Philip Prowse",3.33,92.0,9.0,96.0,Paperback,,Romance
897,First Impressions,Nora Roberts,3.85,11270.0,506.0,218.0,Mass Market Paperback,,"Romance, Christmas, Fiction, Contemporary Romance, Contemporary, Holiday, Chick Lit"
898,Building Literacy With Love: A Guide for Teachers and Caregivers of Children Birth Through Age 5,"Betty S. Bardige, Marilyn M. Segal",3.6,15.0,1.0,366.0,Paperback,,
899,One World?: Topic Reader Level 5 (Reading 2000),Catherine Allan,5.0,1.0,,24.0,Paperback,,
900,The Five Love Languages: Men&apos;s Edition: How to Express Heartfelt Commitment to Your Mate,Gary Chapman,4.26,3515.0,266.0,208.0,Paperback,,"Self Help, Nonfiction, Relationships, Marriage, Psychology, Christian, Love"
901,The Five Love Languages of Children,"Gary Chapman, D. Ross Campbell",4.17,28391.0,2520.0,224.0,Paperback,,"Parenting, Nonfiction, Self Help, Psychology, Christian, Relationships, Family"
902,Los cinco lenguajes del amor para solteros,Gary Chapman,4.12,12684.0,1085.0,235.0,Paperback,,"Nonfiction, Self Help, Relationships, Christian, Psychology, Personal Development, Audiobook"
903,The Five Love Languages of Teenagers,Gary Chapman,4.15,3995.0,420.0,272.0,Paperback,,"Parenting, Nonfiction, Self Help, Christian, Psychology, Relationships, Family"
904,The 5 Love Languages / The 5 Love Languages Journal,Gary Chapman,4.41,92.0,9.0,0.0,Paperback,,
905,The Five Love Languages: Mens Edition; How to Express Heartfelt Commitment to Your Mate,Gary Chapman,4.26,3515.0,266.0,4.0,Audio CD,,"Self Help, Nonfiction, Relationships, Marriage, Psychology, Christian, Love"
906,Five Love Languages Journal: How To Express Heartfelt Commitment To Your Mate,Gary Chapman,4.28,465894.0,18491.0,144.0,Hardcover,Audie Award Personal Development/Motivational (2006),"Nonfiction, Self Help, Relationships, Psychology, Marriage, Christian, Personal Development"
907,The Five Love Languages: How to Express Heartfelt Commitment to Your Mate,Gary Chapman,4.28,465894.0,18491.0,,video pack,Audie Award Personal Development/Motivational (2006),"Nonfiction, Self Help, Relationships, Psychology, Marriage, Christian, Personal Development"
908,Los cinco lenguajes del amor: Edición para hombres: Como expresarle a su conyuge la sinceridad de su entrega,Gary Chapman,4.28,465894.0,18491.0,196.0,Paperback,Audie Award Personal Development/Motivational (2006),"Nonfiction, Self Help, Relationships, Psychology, Marriage, Christian, Personal Development"
909,"Angels &amp; Demons (Robert Langdon, #1)",Dan    Brown,3.95,3336048.0,35942.0,736.0,Paperback,Humo&apos;s Gouden Bladwijzer (2005),"Fiction, Mystery, Thriller, Mystery Thriller, Suspense, Adventure, Crime"
910,Angels (and Demons): What Do We Really Know About Them?,Peter Kreeft,4.08,672.0,57.0,157.0,Paperback,,"Religion, Catholic, Christianity, Theology, Nonfiction, Christian, Faith"
911,"Angels, Demons &amp; Gods of the New Millenium: Musings on Modern Magick",Lon Milo DuQuette,4.13,208.0,11.0,192.0,Paperback,,"Magick, Occult, Thelema, Magic, Nonfiction, Witchcraft, Spirituality"
912,Angels and Demons in Art (A Guide to Imagery),"Rosa Giorgi, Stefano Zuffi, Rosanna M. Giammanco-Frongia",4.13,116.0,10.0,384.0,Paperback,,"Art, Nonfiction, Religion, History, Art History, Reference, Mythology"
913,Secrets of Angels and Demons,"Dan Burstein, David A. Shugarts, Arne de Keijzer, Arne Dekeijzer",3.53,190.0,16.0,384.0,Paperback,,"Nonfiction, History, Religion, Reference"
914,"Ángeles y demonios (Robert Langdon, #1)","Dan    Brown, John Langdon-Davies, Eduardo G. Murillo",3.95,3336048.0,35942.0,528.0,Paperback,Humo&apos;s Gouden Bladwijzer (2005),"Fiction, Mystery, Thriller, Mystery Thriller, Suspense, Adventure, Crime"
915,"Ángeles y Demonios (Robert Langdon, #1)","Dan    Brown, Raúl Amundaray, Aleix Montoto",3.95,3336048.0,35942.0,10.0,Audio CD,Humo&apos;s Gouden Bladwijzer (2005),"Fiction, Mystery, Thriller, Mystery Thriller, Suspense, Adventure, Crime"
916,Angel Customers &amp; Demon Customers: Discover Which is Which and Turbo-Charge Your Stock,"Larry Selden, Geoffrey Colvin",3.34,29.0,3.0,256.0,Hardcover,,Business
917,"The da Vinci Code (Robert Langdon, #2)",Dan    Brown,3.93,2464875.0,57940.0,489.0,Paperback,"British Book Award Book of the Year (2005), Book Sense Book of the Year Award Adult Fiction (2004), Humo&apos;s Gouden Bladwijzer (2004), Zilveren Vingerafdruk (2004), The Flume: New Hampshire Teen Reader&apos;s Choice Award (2006), Teen Buckeye Book Award (2005), Iowa High School Book Award (2006), Puddly Award Fiction (2007), Gateway Readers Award Adult (2006)","Fiction, Mystery, Thriller, Mystery Thriller, Historical Fiction, Suspense, Adventure"
918,"The Da Vinci Code (Robert Langdon, #2)",Dan    Brown,3.93,2464875.0,57940.0,467.0,Paperback,"British Book Award Book of the Year (2005), Book Sense Book of the Year Award Adult Fiction (2004), Humo&apos;s Gouden Bladwijzer (2004), Zilveren Vingerafdruk (2004), The Flume: New Hampshire Teen Reader&apos;s Choice Award (2006), Teen Buckeye Book Award (2005), Iowa High School Book Award (2006), Puddly Award Fiction (2007), Gateway Readers Award Adult (2006)","Fiction, Mystery, Thriller, Mystery Thriller, Historical Fiction, Suspense, Adventure"
919,Fodor&apos;s Guide to The Da Vinci Code: On the Trail of the Best-Selling Novel,"Jennifer Paull, Christopher Culwell",3.63,49.0,9.0,256.0,Paperback,,"Nonfiction, Travel"
920,The Truth Behind the Da Vinci Code: A Challenging Response to the Bestselling Novel,Richard Abanes,3.29,85.0,8.0,96.0,Paperback,,"Nonfiction, Christian, Religion"
921,"Da Vinci Code (Robert Langdon, #2)","Dan    Brown, Daniel Roche",3.93,2464875.0,57940.0,744.0,Paperback,"British Book Award Book of the Year (2005), Book Sense Book of the Year Award Adult Fiction (2004), Humo&apos;s Gouden Bladwijzer (2004), Zilveren Vingerafdruk (2004), The Flume: New Hampshire Teen Reader&apos;s Choice Award (2006), Teen Buckeye Book Award (2005), Iowa High School Book Award (2006), Puddly Award Fiction (2007), Gateway Readers Award Adult (2006)","Fiction, Mystery, Thriller, Mystery Thriller, Historical Fiction, Suspense, Adventure"
922,"Who Can Crack the Leonardo Da Vinci Code? (Museum of Adventures, #1)","Thomas C. Brezina, Laurence Sartin",3.49,45.0,,112.0,Paperback,,Childrens
923,The Da Vinci Code: Fact or Fiction?,"Hank Hanegraaff, Paul L. Maier",3.76,175.0,15.0,82.0,Paperback,,"Christian, Nonfiction, Religion, Theology"
924,Deception Point,Dan    Brown,3.76,689924.0,11580.0,736.0,Paperback,,"Fiction, Thriller, Mystery, Suspense, Mystery Thriller, Adventure, Science Fiction"
925,Deception Point,Dan    Brown,3.76,689924.0,11580.0,556.0,Paperback,,"Fiction, Thriller, Mystery, Suspense, Mystery Thriller, Adventure, Science Fiction"
926,Deception Point,Dan    Brown,3.76,689924.0,11580.0,585.0,Paperback,,"Fiction, Thriller, Mystery, Suspense, Mystery Thriller, Adventure, Science Fiction"
927,"Point Deception (Cape Perdido, #1)",Marcia Muller,3.74,900.0,86.0,368.0,Mass Market Paperback,,"Mystery, Fiction, Thriller, Suspense, Mystery Thriller, Crime, Murder Mystery"
928,Deception Point,"Dan    Brown, Boyd Gaines",3.76,689924.0,11580.0,6.0,Audio CD,,"Fiction, Thriller, Mystery, Suspense, Mystery Thriller, Adventure, Science Fiction"
929,Deception Point,Dan    Brown,3.76,689924.0,11580.0,480.0,Hardcover,,"Fiction, Thriller, Mystery, Suspense, Mystery Thriller, Adventure, Science Fiction"
930,حقيقة الخديعة,"Dan    Brown, دن براون",3.76,689924.0,11580.0,471.0,Paperback,,"Fiction, Thriller, Mystery, Suspense, Mystery Thriller, Adventure, Science Fiction"
931,Deception Point,Dan    Brown,3.76,689924.0,11580.0,816.0,Hardcover,,"Fiction, Thriller, Mystery, Suspense, Mystery Thriller, Adventure, Science Fiction"
932,Deception Point,Dan    Brown,3.76,689924.0,11580.0,736.0,Paperback,,"Fiction, Thriller, Mystery, Suspense, Mystery Thriller, Adventure, Science Fiction"
933,"A Killing Rain (Louis Kincaid, #6)",P.J. Parrish,4.08,713.0,57.0,0.0,Hardcover,"Anthony Award Best Paperback Original (2006), Shamus Award Best Original PI Paperback (2006)","Mystery, Fiction, Mystery Thriller, Thriller, Amazon, Crime, Suspense"
934,A Killing Rain: The Global Threat of Acid Precipitation,Thomas F. Pawlick,4.0,2.0,,206.0,Hardcover,,
935,A Killing Rain and Other Stories,Reid Laurence,5.0,1.0,,244.0,Paperback,,
936,"A Killing Rain (Louis Kincaid, #6)",P.J. Parrish,4.08,713.0,57.0,383.0,Mass Market Paperback,"Anthony Award Best Paperback Original (2006), Shamus Award Best Original PI Paperback (2006)","Mystery, Fiction, Mystery Thriller, Thriller, Amazon, Crime, Suspense"
937,"Winner Take All (John Rain, #3)",Barry Eisler,4.18,9851.0,358.0,366.0,Kindle Edition,Barry Award Best Thriller (2005),"Thriller, Fiction, Mystery, Action, Audiobook, Crime, Espionage"
938,There Wasn&apos;t Any Rain or Storm,Howard  Major,5.0,1.0,,116.0,Paperback,,
939,A Storm Without Rain: A Novel in Time,Jan Adkins,3.98,44.0,11.0,179.0,Hardcover,Vermont Golden Dome Book Award (1985),"Time Travel, Fantasy, Fiction"
940,"Eye of the Storm (Hudson, #3)",V.C. Andrews,3.84,4417.0,74.0,368.0,Paperback,,"Fiction, Horror, Young Adult, Romance, Gothic, Mystery, Adult Fiction"
941,Fire in the Rain...Singer in the Storm: An Autobiography,"Holly Near, Derk Richardson",3.79,29.0,4.0,288.0,Paperback,,"Music, Memoir, LGBT, Biography, Nonfiction, Biography Memoir"
942,Storm in a Rain Barrel (Curley Large Print Books),Anne Mather,3.28,121.0,17.0,262.0,Paperback,,"Harlequin, Harlequin Presents, Romance, Contemporary Romance"
943,What Every Investor Needs to Know About Accounting Fraud,Jeff Madura,3.27,15.0,2.0,160.0,Paperback,,
944,What Every Fidelity Investor Needs to Know,James Lowell,3.86,7.0,1.0,338.0,Hardcover,,
945,What Every Real Estate Investor Needs to Know about Cash Flow... And 36 Other Key Financial Measures,Frank Gallinelli,4.14,1394.0,59.0,261.0,Paperback,,"Business, Finance, Nonfiction, Personal Finance, Economics, Money, Entrepreneurship"
946,The Real Estate Investor&apos;s Tax Guide: What Every Investor Needs to Know to Maximize Profits,Vernon Hoven,5.0,1.0,,289.0,Paperback,,
947,The Millionaire Next Door: The Surprising Secrets of America&apos;s Wealthy,"Thomas J. Stanley, William D. Danko",4.04,129205.0,5198.0,258.0,Paperback,Independent Publisher Book Award (IPPY) Business (Finalist) (1997),"Finance, Nonfiction, Business, Personal Finance, Money, Self Help, Economics"
948,The Millionaire Next Door: The Surprising Secrets of Americas Wealthy,"Thomas J. Stanley, William D. Danko",4.04,129205.0,5198.0,272.0,Paperback,Independent Publisher Book Award (IPPY) Business (Finalist) (1997),"Finance, Nonfiction, Business, Personal Finance, Money, Self Help, Economics"
949,Millionaire Women Next Door: The Many Journeys of Successful American Businesswomen,Thomas J. Stanley,3.89,841.0,80.0,320.0,Hardcover,,"Finance, Nonfiction, Business, Money, Personal Finance, Self Help, Personal Development"
950,Millionaire Women Next Door: The Many Journeys of Successful American Businesswomen,Thomas J. Stanley,3.89,841.0,80.0,368.0,Paperback,,"Finance, Nonfiction, Business, Money, Personal Finance, Self Help, Personal Development"
951,Retire Dollar $mart,Jim Miller,,,,200.0,Paperback,,
952,The Millionaire Next Door: The Surprising Secrets of America&apos;s Wealthy,"Thomas J. Stanley, William D. Danko",4.04,129205.0,5198.0,258.0,Library Binding,Independent Publisher Book Award (IPPY) Business (Finalist) (1997),"Finance, Nonfiction, Business, Personal Finance, Money, Self Help, Economics"
953,Think and Grow Rich,Napoleon Hill,4.17,366205.0,11413.0,345.0,Hardcover,,"Self Help, Business, Nonfiction, Finance, Personal Development, Money, Psychology"
954,Think and Grow Rich,"Napoleon Hill, Arthur R. Pell",4.17,366205.0,11413.0,320.0,Paperback,,"Self Help, Business, Nonfiction, Finance, Personal Development, Money, Psychology"
955,"Think and Grow Rich!: The Original Version, Restored and Revised","Napoleon Hill, Ross Cornwell",4.17,366205.0,11413.0,412.0,Paperback,,"Self Help, Business, Nonfiction, Finance, Personal Development, Money, Psychology"
956,Think &amp; Grow Rich,"Napoleon Hill, Bill Hartley",4.17,366205.0,11413.0,368.0,Hardcover,,"Self Help, Business, Nonfiction, Finance, Personal Development, Money, Psychology"
957,Think and Grow Rich,Napoleon Hill,4.17,366205.0,11413.0,300.0,MP3 CD,,"Self Help, Business, Nonfiction, Finance, Personal Development, Money, Psychology"
958,The Think and Grow Rich Action Pack: Learn the Secret Behind Hill&apos;s Success and That of Hundreds of Others (Think and Grow Rich Series),Napoleon Hill,4.17,366205.0,11413.0,352.0,Paperback,,"Self Help, Business, Nonfiction, Finance, Personal Development, Money, Psychology"
959,Think and Grow Rich,Napoleon Hill,4.17,366205.0,11413.0,260.0,Hardcover,,"Self Help, Business, Nonfiction, Finance, Personal Development, Money, Psychology"
960,Think &amp; Grow Rich,Napoleon Hill,4.17,366205.0,11413.0,260.0,Paperback,,"Self Help, Business, Nonfiction, Finance, Personal Development, Money, Psychology"
961,Think &amp; Grow Rich: Instant Motivator,"Napoleon Hill, Earl Nightingale",4.17,366205.0,11413.0,0.0,Audio CD,,"Self Help, Business, Nonfiction, Finance, Personal Development, Money, Psychology"
962,Pragmatic Version Control: Using Subversion (The Pragmatic Starter Kit Series),Mike   Mason,3.6,228.0,16.0,256.0,Paperback,,"Programming, Reference, Software, Technology, Computers, Technical, Computer Science"
963,Version Control with Subversion,"Ben Collins-Sussman, C. Michael Pilato, Brian W. Fitzpatrick",3.61,147.0,11.0,320.0,Paperback,,"Programming, Nonfiction, Reference, Computers, Technical, Computer Science, Engineering"
964,Practical Subversion,"Garrett Rooney, Martin Streicher",3.83,6.0,,336.0,Paperback,,Technical
965,"Control and Subversion: Gender Relations in Tajikistan (Anthropology, Culture and Society)",Colette Harris,4.25,8.0,1.0,216.0,Paperback,,
966,Bodies of Subversion: A Secret History of Women and Tattoo,Margot Mifflin,4.01,561.0,64.0,192.0,Paperback,,"Nonfiction, History, Art, Feminism, Womens, Gender, Historical"
967,The Politics of Subversion: A Manifesto for the Twenty-First Century,Antonio Negri,3.29,34.0,2.0,240.0,Paperback,,"Philosophy, Politics, Nonfiction"
968,Dreams of Subversion in Medieval Jewish Art and Literature,Marc Michael Epstein,3.82,11.0,2.0,200.0,Hardcover,,"Art, Nonfiction, Judaism, Jewish"
969,Recovering Subversion: Feminist Politics Beyond the Law,Nivedita Menon,4.38,26.0,1.0,288.0,Hardcover,,"Feminism, Nonfiction, India"
970,Read My Lips: Sexual Subversion and the End of Gender,Riki Anne Wilchins,4.02,295.0,24.0,234.0,Paperback,Lambda Literary Award Transgender (1998),"Queer, Nonfiction, Gender, LGBT, Transgender, Gender Studies, Feminism"
971,101 Ways to Massively Increase the Value of Your Real Estate without Spending Much Money,Dolf de Roos,4.02,54.0,5.0,96.0,Paperback,,
972,Real Estate Riches: How to Become Rich Using Your Banker&apos;s Money,Dolf de Roos,4.12,5396.0,50.0,224.0,Paperback,,"Business, Finance, Self Help, Nonfiction, Personal Finance, Money, Audiobook"
973,The Insider&apos;s Guide to 52 Homes in 52 Weeks: Acquire Your Real Estate Fortune Today,"Dolf de Roos, Gene Burns",3.91,64.0,7.0,208.0,Paperback,,
974,Real Estate Riches,Dolf de Roos,4.12,5396.0,50.0,4.0,Audio CD,,"Business, Finance, Self Help, Nonfiction, Personal Finance, Money, Audiobook"
975,The Insider&apos;s Guide to Tax-Free Real Estate Investments: Retire Rich Using Your IRA,"Diane Kennedy, Dolf de Roos",3.0,7.0,2.0,256.0,Paperback,,
976,Extraordinary Profits from Ordinary Properties,Dolf de Roos,2.33,3.0,,95.0,Paperback,,Business
977,The New Zealand Investor&apos;s Guide to Making Money in Residential Real Estate,"Jan Somers, Dolf de Roos",3.67,6.0,1.0,64.0,Paperback,,Business
978,Real Estate Riches: How to Become Rich Using Your Banker&apos;s Money (Rich Dad&apos;s Advisors),"Dolf de Roos, Robert T. Kiyosaki",4.12,5396.0,50.0,192.0,Paperback,,"Business, Finance, Self Help, Nonfiction, Personal Finance, Money, Audiobook"
979,"Trump: Think Like a Billionaire: Everything You Need to Know About Success, Real Estate, and Life","Donald J. Trump, Meredith McIver",3.63,2257.0,166.0,288.0,Unknown Binding,,"Business, Nonfiction, Finance, Self Help, Money, Biography, Entrepreneurship"
980,Trump: The Art of the Deal,"Donald J. Trump, Tony Schwartz",3.7,24171.0,1943.0,384.0,Paperback,,"Business, Biography, Nonfiction, Politics, Finance, Self Help, Autobiography"
981,Trump Strategies for Real Estate: Billionaire Lessons for the Small Investor,"George H. Ross, Donald J. Trump, Andrew James McLean",4.11,738.0,28.0,256.0,Paperback,,"Business, Finance, Nonfiction"
982,Trump University Real Estate 101: Building Wealth with Real Estate Investments,"Gary W. Eldred, Donald J. Trump",3.61,207.0,11.0,304.0,Hardcover,,"Business, Finance, Self Help, Economics"
983,Trump: How to Get Rich,"Donald J. Trump, Meredith McIver",3.39,3014.0,240.0,320.0,Unknown Binding,,"Business, Nonfiction, Self Help, Finance, Biography, Money, Personal Development"
984,Trump: The Way to the Top: The Best Business Advice I Ever Received,Donald J. Trump,3.35,419.0,35.0,256.0,Hardcover,,"Business, Nonfiction, Self Help, Personal Development"
985,Trump: The Art of the Deal,"Donald J. Trump, Tony Schwartz",3.7,24171.0,1943.0,0.0,Hardcover,,"Business, Biography, Nonfiction, Politics, Finance, Self Help, Autobiography"
986,Trump: Surviving at the Top,"Donald J. Trump, Charles Leerhsen",3.47,229.0,20.0,229.0,Hardcover,,"Business, Biography, Self Help, Nonfiction, Autobiography"
987,How to Build a Fortune [With CD-ROM with Workbook and Trump Cards and DVD],Donald J. Trump,2.93,40.0,4.0,101.0,Audio CD,,
988,Real Estate Goldmine: How to get Rich Investing in Pre-Foreclosures,"Donald J. Trump, Gary W. Eldred",2.66,35.0,,114.0,Audio CD,,
989,Trump: The Best Real Estate Advice I Ever Received: 100 Top Experts Share Their Strategies,Donald J. Trump,3.62,300.0,26.0,273.0,Hardcover,,"Business, Nonfiction, Finance"
990,Three Master Secrets of Real Estate Success,"Curtis Oakes, Peter Harris, Donald J. Trump",3.44,25.0,,97.0,Audio CD,,
991,I Ain&apos;t Scared of You: Bernie Mac on How Life Is,"Bernie Mac, Darrell Dawsey",4.06,204.0,15.0,176.0,Paperback,,"Nonfiction, Biography, Comedy, Humor, Audiobook, African American"
992,Maybe You Never Cry Again,"Bernie Mac, Pablo F. Fenjves",4.33,678.0,107.0,304.0,Paperback,,"Memoir, Nonfiction, Biography, Comedy, Autobiography, African American, Collections"
993,Bernie Mac (Blue Banner Biographies),Joanne Mattern,5.0,2.0,,32.0,Library Binding,,
994,"Love, Medicine &amp; Miracles: The Interactive Workshop on CD-ROM",Bernie S. Siegel,4.0,3.0,,0.0,CD-ROM,,
995,The Beginner&apos;s Guide to Real Estate Investing,Gary W. Eldred,3.67,101.0,8.0,312.0,Paperback,,Business
996,The Art of Deals &amp; Dreams: The Complete Beginner&apos;s Guide to Intelligent Real Estate Investing,Carlos Redmond,5.0,1.0,,154.0,Paperback,,
997,Jump Start: A Beginner&apos;s Guide to Basic Real Estate Investing,Hasani K. Bakari,,,,142.0,Paperback,,
998,Riches in Real Estate: A Beginner&apos;s Guide to Group Investing,Robert  Irwin,,,,209.0,Hardcover,,
999,Investing Without Losing: The Beginner&apos;s Guide to Real Estate Tax Lien and Tax Deed Auctions,"Don Sausa, Jody Ortiz",4.0,2.0,,108.0,Paperback,,
1000,The Richest Man in Babylon,George S. Clason,4.23,232016.0,12266.0,194.0,Paperback,,"Finance, Business, Nonfiction, Self Help, Personal Finance, Money, Personal Development"
1001,The Richest Man in Babylon,George S. Clason,4.23,232016.0,12266.0,4.0,Audio CD,,"Finance, Business, Nonfiction, Self Help, Personal Finance, Money, Personal Development"
1002,The Richest Man in Babylon for Today: New Secrets for Building Wealth in the 21st Century,"Fred Siegel, Rick Crandall",3.92,75.0,10.0,150.0,Hardcover,,Nonfiction
