,Title,Author(s),Rating,Rating_count,Review_count,No. of Pages,Format,Awards,Genres
1444,Electra (Plays of Euripides),"Euripides, J.D. Denniston",3.95,8086.0,364.0,272.0,Paperback,,"Plays, Classics, Drama, Mythology, Fiction, Theatre, Ancient"
1445,Hippolytos,"Euripides, Robert Bagg",3.81,6763.0,415.0,128.0,Paperback,,"Classics, Plays, Drama, Mythology, Fiction, Ancient, Tragedy"
1446,Trojan Women / Iphigenia Among the Taurians / Ion,"Euripides, David Kovacs",4.26,42.0,3.0,528.0,Hardcover,,"Classics, Drama, Theatre, Plays"
1447,Helen / Phoenician Women / Orestes,"Euripides, David Kovacs",4.17,162.0,18.0,624.0,Hardcover,,"Classics, Plays, Drama, Poetry, Fiction, Literature, Mythology"
1448,Euripides: Iphigenia at Aulis (Companions to Greek &amp; Roman Tragedy),"Euripides, Pantelis Michelakis",4.02,6007.0,331.0,176.0,Paperback,,"Plays, Classics, Drama, Mythology, Fiction, Theatre, Tragedy"
1449,The Hippolytus of Euripides,"Euripides, J. P. Mahaffey",3.81,6763.0,415.0,140.0,Paperback,,"Classics, Plays, Drama, Mythology, Fiction, Ancient, Tragedy"
1450,Euripides: The Complete Plays Volume III,"Euripides, Carl R. Mueller",4.25,8.0,2.0,319.0,Hardcover,,Plays
1451,The Bacchae of Euripides: A New Translation with a Critical Essay,"Euripides, Donald   Sutherland",3.93,24168.0,1676.0,154.0,Paperback,,"Classics, Plays, Drama, Mythology, Fiction, Theatre, Poetry"
1452,The Complete Greek Tragedies: Euripides,"Euripides, David Grene, Richmond Lattimore",4.41,63.0,11.0,672.0,Hardcover,,"Plays, Classics, Drama, Classical Studies, Literature, Theatre"
1453,"Aeschylus I: Oresteia (Agamemnon, The Libation Bearers, The Eumenides)","Aeschylus, Richmond Lattimore, David Grene",3.93,856.0,67.0,171.0,Paperback,,"Classics, Plays, Drama, Fiction, Mythology, Literature, School"
1454,"Aeschylus II: The Suppliant Maidens, The Persians, Seven against Thebes, and Prometheus Bound (The Complete Greek Tragedies)","Aeschylus, Seth G. Benardete, David Grene, Richmond Lattimore",3.99,8656.0,311.0,188.0,Paperback,,"Classics, Plays, Drama, Mythology, Fiction, Poetry, Literature"
1455,The Oresteia,"Aeschylus, Alan Shapiro, Peter H. Burian",4.02,45422.0,2010.0,304.0,Paperback,National Book Award Finalist Translation (1977),"Plays, Fiction, Mythology, Poetry, Literature, Theatre, Classics"
1456,"The Oresteia: Agamemnon, The Libation Bearers, The Eumenides","Aeschylus, Robert Fagles, W.B. Stanford",4.02,45422.0,2010.0,336.0,Paperback,National Book Award Finalist Translation (1977),"Plays, Fiction, Mythology, Poetry, Literature, Theatre, Classics"
1457,Aeschylus Persae,"Aeschylus, Arthur Sidgwick",3.49,386.0,48.0,0.0,Hardcover,,"Plays, Drama, Classics, Fiction, Mythology, War, Tragedy"
1458,Oresteia,"Aeschylus, Peter Meineck, Helene P. Foley",4.02,45422.0,2010.0,224.0,Paperback,National Book Award Finalist Translation (1977),"Plays, Fiction, Mythology, Poetry, Literature, Theatre, Classics"
1459,Suppliant Maidens/Persians/Prometheus/Seven Against Thebes (Loeb Classical Library 145),"Aeschylus, Herbert Weir Smyth",3.99,8656.0,311.0,624.0,cloth,,"Classics, Plays, Drama, Mythology, Fiction, Poetry, Literature"
1460,Prometheus Bound and Other Plays,"Aeschylus, Philip Vellacott",3.99,8656.0,311.0,160.0,Paperback,,"Classics, Plays, Drama, Mythology, Fiction, Poetry, Literature"
1461,"Agamemnon (Oresteia, #1)","Aeschylus, Philip de May, P.E. Easterling",3.84,21935.0,745.0,144.0,Paperback,,"Classics, Plays, Mythology, Fiction, Literature, Poetry, School"
1462,The Oresteia,"Aeschylus, Ted Hughes",4.02,45422.0,2010.0,208.0,Paperback,National Book Award Finalist Translation (1977),"Plays, Fiction, Mythology, Poetry, Literature, Theatre, Classics"
1463,"Aeschylus, 1: The Oresteia: Agamemnon/The Libation Bearers/The Eumenides","Aeschylus, David R. Slavitt, Smith Palmer Bovie",4.02,45422.0,2010.0,178.0,paper,National Book Award Finalist Translation (1977),"Plays, Fiction, Mythology, Poetry, Literature, Theatre, Classics"
1464,The Complete Greek Tragedies: Aeschylus,"Aeschylus, Richmond Lattimore, David Grene",4.2,152.0,17.0,358.0,Hardcover,,"Classics, Plays, Drama, Mythology, Poetry, Theatre, Fiction"
1465,Aeschylus: Seven Plays (The Greek Classics),"Aeschylus, James H. Ford, Edward Morshead",4.07,1489.0,138.0,256.0,paper,,"Classics, Plays, Fiction, Theatre, Mythology, Poetry, Drama"
1466,Aeschylus: The Oresteia (A Student Guide: Landmarks of World Literature),Simon Goldhill,3.97,60.0,4.0,105.0,Paperback,,"Classics, Nonfiction, Drama, Mythology, Philosophy, Plays, Theatre"
1467,"The Oresteia: Agamemnon, Choephoroe, Eumenides","Aeschylus, George Thomson, Richard Seaford",4.02,45422.0,2010.0,127.0,Hardcover,National Book Award Finalist Translation (1977),"Plays, Fiction, Mythology, Poetry, Literature, Theatre, Classics"
1468,"Aeschylus, 2: The Persians/Seven Against Thebes/The Suppliants/Prometheus Bound","Aeschylus, David R. Slavitt, Palmer Bovie",3.99,8656.0,311.0,232.0,paper,,"Classics, Plays, Drama, Mythology, Fiction, Poetry, Literature"
1469,"The Oresteia Trilogy: Agamemnon, the Libation-Bearers and the Furies","Aeschylus, E.D.A. Morshead",4.02,45422.0,2010.0,151.0,Paperback,National Book Award Finalist Translation (1977),"Plays, Fiction, Mythology, Poetry, Literature, Theatre, Classics"
1470,"The Suppliant Maidens, the Persians, the Seven Against Thebes, the Prometheus Bound","Aeschylus, E.D.A. Morshead",3.99,8656.0,311.0,208.0,paper,,"Classics, Plays, Drama, Mythology, Fiction, Poetry, Literature"
1471,Oresteia,"Aeschylus, Christopher Collard",4.02,45422.0,2010.0,320.0,Paperback,National Book Award Finalist Translation (1977),"Plays, Fiction, Mythology, Poetry, Literature, Theatre, Classics"
1472,"Sophocles I: Oedipus The King, Oedipus at Colonus, Antigone (The Complete Greek Tragedies, #8)","Sophocles, David Grene, Richmond Lattimore",3.99,69506.0,2724.0,218.0,Paperback,City of Dionysia Award Second Place,"Plays, Fiction, Mythology, School, Literature, Classics, Poetry"
1473,"Sophocles II: Ajax, Women of Trachis, Electra, Philoctetes (Complete Greek Tragedies, #4)","Sophocles, David Grene, Michael Jameson, John Moore, Richmond Lattimore",4.13,6817.0,220.0,254.0,Paperback,,"Classics, Plays, Drama, Fiction, Mythology, Tragedy, Theatre"
1474,The Oedipus Plays of Sophocles: Oedipus the King - Oedipus at Colonus - Antigone,"Sophocles, Paul Roche",3.99,69506.0,2724.0,288.0,Paperback,City of Dionysia Award Second Place,"Plays, Fiction, Mythology, School, Literature, Classics, Poetry"
1475,Sophocles: The Complete Plays,"Sophocles, Paul Roche",4.26,5183.0,234.0,420.0,Mass Market Paperback,,"Classics, Plays, Drama, Fiction, Mythology, Poetry, Literature"
1476,The Complete Plays of Sophocles,"Sophocles, Moses Hadas, Richard Claverhouse Jebb",4.26,5183.0,234.0,304.0,Mass Market Paperback,,"Classics, Plays, Drama, Fiction, Mythology, Poetry, Literature"
1477,"The Oedipus Cycle: Oedipus Rex, Oedipus at Colonus, Antigone","Sophocles, Dudley Fitts, Robert Fitzgerald",3.99,69506.0,2724.0,259.0,Paperback,City of Dionysia Award Second Place,"Plays, Fiction, Mythology, School, Literature, Classics, Poetry"
1478,Antigone (Translations from Greek Drama),"Sophocles, David Franklin, John Harrison, P.E. Easterling",3.68,169304.0,7729.0,118.0,Paperback,,"Classics, Plays, School, Fiction, Drama, Mythology, Read For School"
1479,"The Three Theban Plays: Antigone, Oedipus the King, Oedipus at Colonus","Sophocles, Robert Fagles, Bernard Knox",3.99,69506.0,2724.0,430.0,Paperback,City of Dionysia Award Second Place,"Plays, Fiction, Mythology, School, Literature, Classics, Poetry"
1480,Ajax - Electra - Oedipus Tyrannus,"Sophocles, Hugh Lloyd-Jones",4.51,146.0,11.0,483.0,Hardcover,,"Classics, Fiction, Drama, Plays, Poetry, Literature, Tragedy"
1481,Antigone (Greek and Latin Classics),"Sophocles, Mark Griffith",3.68,169304.0,7729.0,376.0,Paperback,,"Classics, Plays, School, Fiction, Drama, Mythology, Read For School"
1482,"Sophocles I: Oedipus the King, Oedipus at Colonus, Antigone (Complete Greek Tragedies)","Sophocles, David Grene, Richmond Lattimore",3.99,69506.0,2724.0,212.0,Mass Market Paperback,City of Dionysia Award Second Place,"Plays, Fiction, Mythology, School, Literature, Classics, Poetry"
1483,Theban Plays (Hackett Classics),"Sophocles, Peter Meineck, Paul Woodruff",3.99,69506.0,2724.0,304.0,Paperback,City of Dionysia Award Second Place,"Plays, Fiction, Mythology, School, Literature, Classics, Poetry"
1484,"The Theban Plays (Everyman&apos;s Library, #93)","Sophocles, David Grene, Charles Segal, James P. Hogan",3.99,69506.0,2724.0,223.0,Hardcover,City of Dionysia Award Second Place,"Plays, Fiction, Mythology, School, Literature, Classics, Poetry"
1485,Electra and Other Plays,"Sophocles, E.F. Watling",4.13,6817.0,220.0,218.0,Paperback,,"Classics, Plays, Drama, Fiction, Mythology, Tragedy, Theatre"
1486,Antigone - Oedipus the King - Electra,"Sophocles, Edith Hall, H.D.F. Kitto",3.94,16339.0,411.0,178.0,Paperback,,"Classics, Plays, Fiction, Drama, School, Mythology, Literature"
1487,Antigone (Focus Classical Library),"Sophocles, Ruby Blondell",3.68,169304.0,7729.0,120.0,Paperback,,"Classics, Plays, School, Fiction, Drama, Mythology, Read For School"
1488,"Sophocles Plays: 2: Ajax, Women of Trachis, Electra, Philoctetes","Sophocles, J. Michael Walton, Kenneth McLeish, Robert Cannon",4.13,6817.0,220.0,256.0,Paperback,,"Classics, Plays, Drama, Fiction, Mythology, Tragedy, Theatre"
1489,Introduction to Signal Processing,Sophocles J. Orfanidis,4.0,2.0,2.0,816.0,Paperback,,
1490,A World of Heroes,Joint Association of Classical Teachers’ Greek Course,4.2,5.0,,152.0,Paperback,,
1491,"Oedipus Rex  (The Theban Plays, #1)","Sophocles, J.E. Thomas, Elizabeth Osborne",3.72,231003.0,7478.0,75.0,Paperback,,"Classics, Plays, Fiction, Drama, School, Mythology, Read For School"
1492,The Oedipus Plays of Sophocles,"Sophocles, Paul Roche",3.99,69506.0,2724.0,390.0,Mass Market Paperback,City of Dionysia Award Second Place,"Plays, Fiction, Mythology, School, Literature, Classics, Poetry"
1493,Oedipus Rex,"Sophocles, E.H. Plumptre, William-Alan Landes",3.72,231003.0,7478.0,48.0,Paperback,,"Classics, Plays, Fiction, Drama, School, Mythology, Read For School"
1494,"Sophocles, 1: Ajax/Women of Trachis/Electra/Philoctetes","Sophocles, David R. Slavitt, Palmer Bovie",4.13,6817.0,220.0,296.0,Paperback,,"Classics, Plays, Drama, Fiction, Mythology, Tragedy, Theatre"
1495,Oedipus Rex (Greek and Latin Classics),"Sophocles, Roger D. Dawe",3.72,231003.0,7478.0,214.0,Paperback,,"Classics, Plays, Fiction, Drama, School, Mythology, Read For School"
1496,Oedipus the King,"Sophocles, Bernard Knox",3.72,231003.0,7478.0,144.0,Mass Market Paperback,,"Classics, Plays, Fiction, Drama, School, Mythology, Read For School"
1497,Four Plays: The Clouds/The Birds/Lysistrata/The Frogs,"Aristophanes, William Arrowsmith, Richmond Lattimore, Douglass Parker",4.06,6748.0,118.0,624.0,Paperback,,"Classics, Plays, Drama, Fiction, Literature, Theatre, Philosophy"
1498,Three Plays by Aristophanes: Staging Women,"Aristophanes, Jeffrey Henderson",3.96,182.0,16.0,256.0,Paperback,,"Classics, Plays, Fiction, Drama, College, Satire, Poetry"
1499,The Complete Plays of Aristophanes,"Aristophanes, Benjamin Bickley Rogers, R.H. Webb, Moses Hadas, Jack Lindsay",4.18,2822.0,86.0,577.0,Mass Market Paperback,,"Classics, Plays, Drama, Fiction, Literature, Poetry, Ancient"
1500,"Aristophanes, 1: The Acharnians/Peace/Celebrating Ladies/Wealth","Aristophanes, David R. Slavitt, Palmer Bovie",3.83,6.0,,336.0,Hardcover,,
1501,Birds - Lysistrata - Women at the Thesmophoria,"Aristophanes, Jeffrey Henderson",4.15,104.0,11.0,624.0,Hardcover,,"Classics, Drama, Plays, Literature, Theatre"
1502,Lysistrata / The Acharnians / The Clouds,"Aristophanes, Alan H. Sommerstein",3.86,52191.0,2191.0,256.0,Paperback,,"Plays, Drama, Fiction, Classics, Humor, Literature, School"
1503,Clouds/Wasps/Birds (Aristophanes 1),"Aristophanes, Peter Meineck, Ian C. Storey",3.83,173.0,16.0,480.0,Hardcover,,"Drama, Classics, Plays, Fiction, Poetry, Literature, Comedy"
1504,Lysistrata and Other Plays,Aristophanes,3.86,52191.0,2191.0,241.0,Paperback,,"Plays, Drama, Fiction, Classics, Humor, Literature, School"
1505,Acharnians,"Aristophanes, Jeffrey Henderson",3.41,1029.0,105.0,96.0,Paperback,Lenaea Festival Prize,"Plays, Classics, Drama, Fiction, Ancient, Comedy, Humor"
1506,Clouds,"Aristophanes, Jeffrey Henderson",3.61,11429.0,770.0,97.0,Paperback,,"Classics, Plays, Drama, Fiction, Philosophy, Theatre, Literature"
1507,Lysistrata,"Aristophanes, Jeffrey Henderson",3.86,52191.0,2191.0,96.0,Paperback,,"Plays, Drama, Fiction, Classics, Humor, Literature, School"
1508,Clouds,"Aristophanes, K.J. Dover",3.61,11429.0,770.0,256.0,Paperback,,"Classics, Plays, Drama, Fiction, Philosophy, Theatre, Literature"
1509,Clouds - Wasps - Peace,"Aristophanes, Jeffrey Henderson",4.08,86.0,10.0,624.0,Hardcover,,"Drama, Plays, Classics, Theatre, Fiction, Humor"
1510,The Birds and Other Plays,"Aristophanes, David Barrett, Alan Sommerstein",4.11,1653.0,53.0,336.0,Paperback,,"Plays, Classics, Fiction, Drama, Poetry, Literature, Ancient"
1511,Socrates and Aristophanes,Leo Strauss,4.09,55.0,3.0,332.0,Paperback,,"Philosophy, Nonfiction"
1512,Four Major Plays: Lysistrata/The Birds/The Clouds/The Acharnians,Aristophanes,3.67,27.0,4.0,222.0,Paperback,,"Drama, Classics"
1513,The Wasps / The Poet and the Women / The Frogs,"Aristophanes, David Barrett",4.02,1856.0,115.0,224.0,Paperback,,"Classics, Plays, Drama, Fiction, Theatre, Ancient, Literature"
1514,Four Comedies: Lysistrata / The Frogs / The Birds / Ladies&apos; Day,"Aristophanes, Dudley Fitts",3.88,41.0,8.0,400.0,Paperback,,"Classics, Plays, Drama, Fiction"
1515,Four Comedies: Lysistrata/The Acharnians/The Congresswomen/The Frogs,"Aristophanes, William Arrowsmith, Douglas Parker, Richmond Lattimore",3.86,100.0,16.0,432.0,Paperback,,"Classics, Plays, Drama, Literature"
1516,Frogs/Assemblywomen/Wealth (Loeb Classical Library 180),"Aristophanes, Jeffrey Henderson",4.15,73.0,7.0,608.0,hardback,,"Plays, Classics, Drama, Theatre, Fiction"
1517,"Aristophanes, 2: Wasps/Lysistrata/Frogs/The Sexual Congress","Aristophanes, David R. Slavitt, Palmer Bovie",3.89,18.0,2.0,376.0,Paperback,,"Ancient History, Classics"
1518,"Aristophanes: Myth, Ritual and Comedy",Angus M. Bowie,3.57,7.0,,348.0,Paperback,,
1519,The Frogs,Aristophanes,3.79,8960.0,584.0,100.0,Paperback,Nagrada Miloš N.Đurić (1979),"Plays, Classics, Drama, Fiction, Theatre, Mythology, Humor"
1520,Lysistrata,Aristophanes,3.86,52191.0,2191.0,80.0,Paperback,,"Plays, Drama, Fiction, Classics, Humor, Literature, School"
1521,Cliffs Notes on Aristophanes&apos; Lysistrata: The Birds - The Clouds - The Frogs,"CliffsNotes, W. John Campbell",3.0,5.0,,80.0,Paperback,,
1522,Aristophanes and Athens: An Introduction to the Plays,Douglas M. MacDowell,3.95,19.0,4.0,376.0,Paperback,,"Classics, Biography"
1523,Lysistrata,"Aristophanes, Douglass Parker",3.86,52191.0,2191.0,98.0,Mass Market Paperback,,"Plays, Drama, Fiction, Classics, Humor, Literature, School"
1524,The Birds,"Aristophanes, Jeffrey Henderson",3.84,5097.0,205.0,104.0,Paperback,,"Plays, Drama, Fiction, Theatre, Humor, Ancient, Comedy"
1525,Three Comedies: The Birds/The Clouds/The Wasps,"Aristophanes, William Arrowsmith, Douglas Parker",3.83,173.0,16.0,408.0,Paperback,,"Drama, Classics, Plays, Fiction, Poetry, Literature, Comedy"
1526,Peace,"Aristophanes, S. Douglas Olson",3.49,794.0,56.0,404.0,hardback,,"Plays, Drama, Fiction, Theatre, Humor, Comedy, Ancient"
1527,Lysistrata,"Aristophanes, Sarah Ruden, Jack Lindsay, Alex Struik, Benjamin Jowett",3.86,52191.0,2191.0,132.0,Paperback,,"Plays, Drama, Fiction, Classics, Humor, Literature, School"
1528,The Knights / Peace / The Birds / The Assembly Women / Wealth,"Aristophanes, Alan H. Sommerstein, David B. Barrett, David Brett",3.75,64.0,5.0,335.0,Paperback,,"Classics, Drama, Plays, Literature, Fiction, Theatre, Comedy"
1529,Religion and Politics in Aristophanes&apos; Clouds (Altertumswissenschaftliche Texte und Studien: Band 24),Marie C. Marianetti,,,,140.0,Paperback,,
1530,Spectacles of Truth in Classical Greek Philosophy: Theoria in its Cultural Context,Andrea Wilson Nightingale,4.09,11.0,2.0,322.0,Hardcover,,Philosophy
1531,Genres in Dialogue: Plato and the Construct of Philosophy,Andrea Wilson Nightingale,4.38,13.0,4.0,238.0,Paperback,,"Philosophy, Classical Studies"
1532,The Nightingale Question: Five Poets From Saxony,"Tessa Ransford, Wulf Kirsten, Elmar Schenkel, Andreas Reimann, Uta Mauersberger, Thomas Rosenlöcher",5.0,1.0,,108.0,Paperback,,
1533,Thomas Cole (Famous Artists),Matthew Baigell,3.75,8.0,,88.0,Paperback,,Art
1534,History of American Painting - Volume Three: That Wilder Image (The Native School from Thomas Cole to Winslow Homer),James Thomas Flexner,4.0,4.0,1.0,429.0,Paperback,Francis Parkman Prize (1963),
1535,Thomas Cole,Earl A. Powell III,4.31,13.0,1.0,144.0,Paperback,,"Art, Biography"
1536,The Life and Works of Thomas Cole,"Louis Legrand Noble, Elliot S. Vesell",3.69,16.0,2.0,324.0,Paperback,,"Art, History, Nonfiction"
1537,"The Correspondence of Thomas Cole and Daniel Wadsworth: Letters in the Watkinson Library, Trinity College, Hartford and N. Y. State Lib., Albany, N.",Thomas Cole,,,,74.0,Paperback,,
1538,Thomas Cole&apos;s Paintings of Eden,"Franklin Kelly, Claire M. Barry",2.0,1.0,,71.0,Paperback,,
1539,Thomas Cole&apos;s Poetry: The Collected Poems of America&apos;s Foremost Painter of the Hudson River School,Thomas Cole,3.89,9.0,,220.0,Hardcover,,
1540,Along the Juniata: Thomas Cole and the Dissemination of American Landscape Imagery,Nancy Siegel,2.5,2.0,,150.0,Paperback,,
1541,The Origins of Rhetoric in Ancient Greece (Ancient Society and History),Thomas Cole,3.25,4.0,,208.0,Paperback,,
1542,Rhetoric and the Origins of Medieval Drama (Rhetoric and Society),Jody Enders,4.0,1.0,,304.0,Hardcover,Aldo and Jeanne Scaglione Prize for French and Francophone Studies (1992),
1543,Democracy and Punishment: Disciplinary Origins of the United States (Rhetoric of Humor),Thomas Dumm,4.0,2.0,,224.0,Hardcover,,
1544,"The Puritan Tradition in Revolutionary, Federalist, and Whig Political Theory",Dean Hammer,,,,218.0,Paperback,,
1545,"Rhetoric, the Bible, and the Origins of Free Verse",Katrin Kohl,,,,322.0,Hardcover,,
1546,Political Philosophy and Rhetoric: A Study of the Origins of American Party Politics (Cambridge Studies in the History and Theory of Politics),John Zvesper,3.0,2.0,,237.0,Hardcover,,
1547,The Structure of Ancient Arguments: Rhetoric and Its Near Eastern Origin,Ronald C. Katz,4.0,4.0,1.0,138.0,Hardcover,,
1548,Defining Reality: Definitions and the Politics of Meaning (Rhetorical Philosophy &amp; Theory),Edward Schiappa,4.37,19.0,3.0,232.0,Paperback,,"Philosophy, Politics, Language"
1549,Protagoras and Logos: A Study in Greek Philosophy and Rhetoric (Studies in Rhetoric/Communication),Edward Schiappa,4.14,21.0,2.0,272.0,Paperback,,Philosophy
1550,The Beginnings of Rhetorical Theory in Classical Greece,Edward Schiappa,3.75,4.0,,240.0,Hardcover,,
1551,Mixing: Catholic-Protestant Marriages in the 1980&apos;s: A Guidebook for Couples and Families,Barbara D. Schiappa,2.0,1.0,,143.0,Paperback,,
1552,Gracchus Babeuf avec les Egaux,Jean-Marc Schiappa,,,,264.0,Paperback,,
1553,Night,"Elie Wiesel, Marion Wiesel, François Mauriac",4.38,1327066.0,41140.0,120.0,Paperback,,"Nonfiction, Classics, History, Memoir, School, Holocaust, Biography"
1554,The Curious Incident of the Dog in the Night-Time,Mark Haddon,3.89,1561173.0,59748.0,226.0,Paperback,"Booker Prize Longlist (2003), James Tait Black Memorial Prize Fiction (2003), Whitbread Award Novel and Book of the Year (2003), Guardian Children&apos;s Fiction Prize (2003), Booktrust Teenage Prize (2003), McKitterick Prize (2004), Los Angeles Times Book Prize Art Seidenbaum Award for First Fiction (2003), Exclusive Books Boeke Prize (2004), ALA Alex Award (2004), Zilveren Zoen (2004), Lincoln Award (2006), Commonwealth Writers&apos; Prize Best First Book Overall (2004), North East Teenage Book Award (2004), Carnegie Medal (2003), Dolly Gray Children&apos;s Literature Award (2004), Premi Protagonista Jove Categoria 14-16 anys (2005)","Fiction, Mystery, Young Adult, Contemporary, Book Club, Classics, Autistic Spectrum Disorder"
1555,Night with Connections,Elie Wiesel,4.38,1327066.0,41140.0,193.0,Hardcover,,"Nonfiction, Classics, History, Memoir, School, Holocaust, Biography"
1556,The Night Gardener,George P. Pelecanos,3.68,6545.0,560.0,372.0,Hardcover,Barry Award Best Novel (2007),"Mystery, Fiction, Crime, Thriller, Mystery Thriller, Noir, Detective"
1557,"Friday Night Lights: A Town, a Team, and a Dream",H.G. Bissinger,4.14,64624.0,3302.0,357.0,Paperback,,"Sports, Nonfiction, Football, History, Biography, Book Club, Journalism"
1558,A Midsummer Night’s Dream,"William Shakespeare, Barbara A. Mowat, Paul Werstine, Alan Durband, Roma Gill, Catherine Belsey, A.R. Braunmuller",3.94,565483.0,14510.0,298.0,Mass Market Paperback,,"Plays, Fiction, Fantasy, School, Romance, Poetry, Literature"
1559,Night of the Living Dead,"John A. Russo, George A. Romero",3.99,1219.0,103.0,0.0,Paperback,,"Horror, Zombies, Fiction, Audiobook, Classics, Science Fiction, Apocalyptic"
1560,West with the Night,Beryl Markham,4.15,40051.0,4128.0,294.0,Paperback,,"Nonfiction, Memoir, Biography, Africa, Travel, Book Club, History"
1561,Twelfth Night,"William Shakespeare, Folger Shakespeare Library, Barbara A. Mowat, Paul Werstine",3.96,191251.0,6828.0,272.0,Mass Market Paperback,,"Classics, Plays, Drama, Fiction, School, Romance, Theatre"
1562,Brokeback Mountain: Story to Screenplay,"Annie Proulx, Larry McMurtry, Diana Ossana",4.01,49186.0,5142.0,176.0,Hardcover,O. Henry Award (1998),"Fiction, Short Stories, Romance, LGBT, Queer, Gay, Westerns"
1563,Brokeback Mountain,Annie Proulx,4.01,49186.0,5142.0,55.0,Paperback,O. Henry Award (1998),"Fiction, Short Stories, Romance, LGBT, Queer, Gay, Westerns"
1564,Brokeback Mountain,Annie Proulx,4.01,49186.0,5142.0,64.0,Hardcover,O. Henry Award (1998),"Fiction, Short Stories, Romance, LGBT, Queer, Gay, Westerns"
1565,Close Range: Brokeback Mountain and Other stories,Annie Proulx,3.99,17994.0,1581.0,318.0,Paperback,"Pulitzer Prize Fiction (2000), Borders Original Voices Award Fiction (1999), Ambassador Book Award Fiction (2000), Los Angeles Times Book Prize Fiction (1999)","Short Stories, Fiction, Westerns, LGBT, Literature, Contemporary, Literary Fiction"
1566,Brokeback Mountain: Secreto en la montaña,"Annie Proulx, María Corniero",3.99,17994.0,1581.0,332.0,Paperback,"Pulitzer Prize Fiction (2000), Borders Original Voices Award Fiction (1999), Ambassador Book Award Fiction (2000), Los Angeles Times Book Prize Fiction (1999)","Short Stories, Fiction, Westerns, LGBT, Literature, Contemporary, Literary Fiction"
1567,Brokeback Mountain,"Annie Proulx, Campbell Scott",4.01,49186.0,5142.0,55.0,Audio CD,O. Henry Award (1998),"Fiction, Short Stories, Romance, LGBT, Queer, Gay, Westerns"
1568,Brokeback Mountain: Story to Screenplay,"Annie Proulx, Larry McMurtry, Diana Ossana",4.01,49186.0,5142.0,176.0,Paperback,O. Henry Award (1998),"Fiction, Short Stories, Romance, LGBT, Queer, Gay, Westerns"
1569,Getting Things Done: The Art of Stress-Free Productivity,David    Allen,4.01,164564.0,6680.0,267.0,Paperback,,"Nonfiction, Productivity, Business, Self Help, Personal Development, Psychology, Management"
1570,Getting Things Done When You Are Not in Charge,Geoffrey M. Bellman,3.44,119.0,17.0,176.0,Paperback,,"Business, Leadership, Self Help, Nonfiction, Management, Productivity, Reference"
1571,Execution: The Discipline of Getting Things Done,"Larry Bossidy, Ram Charan, Charles Burck",3.87,26625.0,549.0,278.0,Hardcover,,"Business, Leadership, Nonfiction, Management, Self Help, Productivity, Personal Development"
1572,The Complete Idiot&apos;s Guide to Getting Things Done,Jeff Davidson,3.93,29.0,,352.0,Paperback,,"Productivity, Nonfiction"
1573,The Three Ways of Getting Things Done,Gerard Fairtlough,4.17,12.0,2.0,130.0,Paperback,,Management
1574,"Results that Matter: Improving Communities by Engaging Citizens, Measuring Performance, and Getting Things Done","Paul D. Epstein, David Swain, Paul M. Coates, Lyle D. Wray",4.08,13.0,,242.0,Hardcover,,
1575,"The Leader&apos;s Handbook: Making Things Happen, Getting Things Done","Peter R. Scholtes, Russell L. Ackoff",4.16,151.0,10.0,415.0,Spiral-bound,,"Leadership, Business, Management, Nonfiction, Productivity, Self Help"
1576,Execution: The Discipline of Getting Things Done,"Larry Bossidy, Ram Charan",3.87,26625.0,549.0,0.0,Paperback,,"Business, Leadership, Nonfiction, Management, Self Help, Productivity, Personal Development"
1577,Guide to Getting Things Done,Edwin C. Bliss,3.83,151.0,20.0,0.0,Mass Market Paperback,,"Nonfiction, Business, Productivity, Self Help, Reference, Management, Personal Development"
1578,Formas breves,Ricardo Piglia,4.21,581.0,71.0,142.0,Paperback,,"Nonfiction, Writing, Literature, Spanish Literature"
1579,El último lector,Ricardo Piglia,4.1,847.0,119.0,192.0,Hardcover,,"Nonfiction, Spanish Literature, Books About Books, Literature"
1580,The Absent City,"Ricardo Piglia, Sergio Waisman",3.73,1096.0,147.0,160.0,Paperback,,"Fiction, Science Fiction, Spanish Literature, Novels, Mystery, 20th Century, Latin American"
1581,Money to Burn,"Ricardo Piglia, Amanda Hopkinson",3.79,2675.0,262.0,209.0,Paperback,Independent Foreign Fiction Prize Shortlist (2004),"Fiction, Spanish Literature, LGBT, Crime, Latin American, Historical Fiction, Classics"
1582,Respiración artificial,Ricardo Piglia,3.98,2808.0,281.0,224.0,Paperback,,"Fiction, Spanish Literature, Literature, Latin American, Latin American Literature, Novels, 20th Century"
1583,Ricardo Piglia y la cultura de la contravención,Nicolas Bratosevich,,,,333.0,Paperback,,
1584,"Poéticas en suspenso: Migraciones narrativas en Ricardo Piglia, Andres Rivera y Juan José Saer",Edgardo H. Berg,4.5,2.0,,,Paperback,,
