,Title,Author(s),Rating,Rating_count,Review_count,No. of Pages,Format,Awards,Genres
391,Thomas Pynchon (Bloom&apos;s Modern Critical Views),Harold Bloom,3.69,29.0,3.0,322.0,Hardcover,,Literary Criticism
392,Been Down So Long It Looks Like Up to Me,"Richard Fariña, Thomas Pynchon",3.78,3620.0,392.0,352.0,Paperback,,"Fiction, Classics, Novels, Literature, Literary Fiction, American, 20th Century"
393,Vintage Didion,Joan Didion,4.08,531.0,37.0,200.0,Paperback,,"Essays, Nonfiction, American, Classics, Politics, Journalism, Short Stories"
394,The Year of Magical Thinking,Joan Didion,3.93,282173.0,26006.0,227.0,Hardcover,"National Book Award Nonfiction (2005), Puddly Award Nonfiction (2006)","Nonfiction, Memoir, Biography, Grief, Audiobook, Biography Memoir, Book Club"
395,The White Album,Joan Didion,4.04,46537.0,5248.0,224.0,Paperback,"National Book Critics Circle Award General Nonfiction (1979), National Book Award Finalist General Nonfiction (Paperback) (1981)","Nonfiction, Essays, Memoir, Classics, History, Journalism, Biography"
396,A Book of Common Prayer,Joan Didion,3.8,6179.0,689.0,272.0,Paperback,National Book Critics Circle Award Fiction (1977),"Fiction, Literary Fiction, Novels, Contemporary, Literature, Politics, American"
397,Where I Was From,Joan Didion,3.86,6137.0,747.0,240.0,Paperback,,"Nonfiction, Memoir, Essays, History, Biography, Autobiography, American"
398,Slouching Towards Bethlehem,Joan Didion,4.19,77581.0,8410.0,238.0,Paperback,,"Nonfiction, Essays, Memoir, Classics, History, Short Stories, Journalism"
399,Democracy,Joan Didion,3.85,4059.0,511.0,234.0,Paperback,Los Angeles Times Book Prize Fiction (1984),"Fiction, Politics, Historical Fiction, Novels, Literary Fiction, Literature, American"
400,We Tell Ourselves Stories in Order to Live: Collected Nonfiction,"Joan Didion, John Leonard",4.43,2108.0,144.0,1122.0,Hardcover,,"Nonfiction, Essays, Memoir, Short Stories, Journalism, Classics, Biography"
401,Miami,Joan Didion,3.67,2829.0,337.0,240.0,Paperback,Ambassador Book Award American Studies (1988),"Nonfiction, Essays, Politics, History, Journalism, 20th Century, Historical"
402,Play It As It Lays,Joan Didion,3.91,83354.0,10279.0,231.0,Paperback,,"Fiction, Classics, Literary Fiction, Contemporary, Feminism, Novels, Book Club"
403,Amazons: An Intimate Memoir by the First Woman Ever to Play in the National Hockey League,Cleo Birdwell,3.74,159.0,42.0,390.0,Hardcover,,"Sports, Fiction, Hockey, Novels, Humor"
404,Amazons,Cleo Birdwell,3.74,159.0,42.0,362.0,Mass Market Paperback,,"Sports, Fiction, Hockey, Novels, Humor"
405,"The New York Trilogy (New York Trilogy, #1-3)","Paul Auster, Lucy Sante, Art Spiegelman",3.86,83638.0,5353.0,308.0,Paperback,,"Fiction, Mystery, American, Novels, Contemporary, Literature, The United States Of America"
406,"City of Glass (The New York Trilogy, #1)",Paul Auster,3.76,22815.0,1739.0,203.0,Paperback,Edgar Award Best Novel (1986),"Fiction, Mystery, Classics, Literature, Novels, American, Contemporary"
407,The New York Trilogy: City of Glass / Ghosts / The Locked Room,Paul Auster,3.86,83638.0,5353.0,384.0,Paperback,,"Fiction, Mystery, American, Novels, Contemporary, Literature, The United States Of America"
408,"Ghosts (The New York Trilogy, #2)",Paul Auster,3.6,7638.0,533.0,96.0,Paperback,,"Fiction, Mystery, Literature, American, Crime, Novels, 20th Century"
409,"The Locked Room (The New York Trilogy, #3)",Paul Auster,3.89,6324.0,459.0,179.0,Hardcover,,"Fiction, Mystery, Literature, 20th Century, American, Novels, New York"
410,La trilogía de Nueva York,"Paul Auster, Maribal De Juan",3.86,83638.0,5353.0,344.0,Paperback,,"Fiction, Mystery, American, Novels, Contemporary, Literature, The United States Of America"
411,"New York Trilogy: New York Underground, Trapped, Love and Sex",Paul Hallasy,5.0,2.0,,156.0,Paperback,,
412,"New York Dreams (Virex Trilogy, #3)",Eric Brown,3.74,46.0,9.0,336.0,Paperback,,"Science Fiction, Cyberpunk"
413,"New York Nights (Virex Trilogy, #1)",Eric Brown,3.59,92.0,11.0,327.0,Paperback,,"Science Fiction, Cyberpunk"
414,The New York Trilogy: Whodunit?: Tracking the Structure of Paul Auster&apos;s Anti-Detective Novels (Studien zur Germanistik und Anglistik),Anne M. Holzapfel,5.0,2.0,,,Paperback,,
415,New York Blues (Virex Trilogy),Eric Brown,3.88,43.0,5.0,240.0,Hardcover,,"Science Fiction, Cyberpunk"
416,Pyramids of Montauk: Explorations in Consciousness,"Preston B. Nichols, Peter Moon",3.95,110.0,5.0,256.0,Paperback,,"Conspiracy Theories, Nonfiction, Spirituality, History"
417,"All My Tomorrows (The Orphan Trains Trilogy, #2)","Al Lacy, JoAnna Lacy",4.04,243.0,22.0,352.0,Paperback,,"Christian Fiction, Fiction, Historical Fiction, Christian, Historical, New York, Young Adult"
418,The Brooklyn Follies,Paul Auster,3.88,31383.0,2429.0,306.0,Paperback,,"Fiction, Contemporary, New York, Novels, American, The United States Of America, Literature"
419,Moon Palace,Paul Auster,3.98,28182.0,1673.0,320.0,Paperback,,"Fiction, American, Contemporary, Novels, The United States Of America, Classics, Literature"
420,A Tomb for Anatole,"Stéphane Mallarmé, Paul Auster",4.37,195.0,29.0,202.0,Paperback,,"Poetry, France, Grief"
421,Timbuktu,Paul Auster,3.72,16402.0,1419.0,181.0,Paperback,Premio San Clemente Lingua estranxeira (2001),"Fiction, Dogs, Animals, Novels, American, Contemporary, Literature"
422,Neon Lit: Paul Auster&apos;s City of Glass,"Paul Karasik, David Mazzucchelli, Paul Auster, Bob Callahan",3.96,8626.0,571.0,144.0,Paperback,,"Graphic Novels, Fiction, Mystery, Comics, Graphic Novels Comics, Bande Dessinée, Comix"
423,True Tales of American Life,paul-auster-national-public-radio-staff,3.89,3673.0,409.0,491.0,Paperback,,"Nonfiction, Short Stories, Essays, Memoir, Anthologies, The United States Of America, Biography"
424,The Invention of Solitude,Paul Auster,3.76,16646.0,2005.0,192.0,Paperback,,"Nonfiction, Memoir, Biography, Literature, American, Autobiography, The United States Of America"
425,The Music of Chance,Paul Auster,3.93,12868.0,767.0,217.0,Paperback,PEN/Faulkner Award for Fiction (1991),"Fiction, American, Literature, Novels, The United States Of America, Contemporary, Literary Fiction"
426,Travels in the Scriptorium,Paul Auster,3.26,11097.0,1150.0,145.0,Hardcover,,"Fiction, Novels, Mystery, American, Literature, Contemporary, Literary Fiction"
427,In the Country of Last Things,Paul Auster,3.91,15394.0,1363.0,188.0,Paperback,,"Fiction, Dystopia, Science Fiction, Novels, Post Apocalyptic, American, Literature"
428,Leviathan,Paul Auster,3.97,20616.0,1174.0,275.0,Paperback,Prix Médicis étranger (1993),"Fiction, Novels, Literature, American, The United States Of America, Contemporary, Literary Fiction"
429,Auggie Wren&apos;s Christmas Story,"Paul Auster, Isol",3.85,2400.0,313.0,36.0,Hardcover,,"Short Stories, Christmas, Fiction, American, Literature, The United States Of America, Holiday"
430,Oracle Night,Paul Auster,3.81,17297.0,1205.0,256.0,Hardcover,,"Fiction, Contemporary, American, Novels, Literature, Mystery, The United States Of America"
431,The Random House Book of Twentieth Century French Poetry,Paul Auster,4.5,183.0,13.0,688.0,Paperback,,"Poetry, France, Anthologies"
432,Paul Auster&apos;s New York,"Paul Auster, Frieder Blickle",3.73,84.0,5.0,97.0,Hardcover,,"Fiction, American"
433,The Inner Life of Martin Frost,"Paul Auster, Glenn  Thomas",3.3,413.0,33.0,40.0,Paperback,,"Fiction, Plays, The United States Of America, Film, Literature"
434,Disappearances,Paul Auster,3.31,93.0,6.0,126.0,Paperback,,Poetry
435,The Red Notebook: True Stories,Paul Auster,3.78,5626.0,468.0,104.0,Paperback,,"Nonfiction, Short Stories, Essays, The United States Of America, Literature, Memoir, Biography"
436,Collected Poems,Paul Auster,3.59,325.0,32.0,205.0,Hardcover,,"Poetry, Literature, The United States Of America, American"
437,Paul Auster and Postmodern Quest: On the Road to Nowhere (Modern American Literature),"Ilana Shiloh, Chippy Irvine",5.0,1.0,,221.0,Hardcover,,
438,El libro de las ilusiones,"Paul Auster, Benito Gómez Ibáñez",3.9,26062.0,1713.0,344.0,Paperback,"Borders Original Voices Award Fiction (2002), Dublin Literary Award (2004)","Fiction, Mystery, Contemporary, American, Novels, The United States Of America, Literature"
439,An Art of Desire: Reading Paul Auster (Postmodern Studies 21),Bernd Herzogenrath,4.0,5.0,,256.0,Paperback,,
440,Paul Auster (Bloom&apos;s Modern Critical Views),"Harold Bloom, Amy Sickels",4.15,13.0,,254.0,Hardcover,,
441,"The Art of Hunger: Essays, Prefaces, Interviews, The Red Notebook",Paul Auster,3.86,560.0,24.0,368.0,Paperback,,"Essays, Nonfiction, Literature, Literary Criticism, Criticism, 20th Century, Collections"
442,The World That Is the Book: Paul Auster&apos;s Fiction (Liverpool University Press - Contemporary French &amp; Francopho),Aliki Varvogli,3.55,11.0,1.0,200.0,Hardcover,,"Nonfiction, Literary Criticism, Literary Fiction"
443,Why Write?,Paul Auster,3.8,174.0,18.0,58.0,Paperback,,"Writing, Essays, Nonfiction, Memoir"
444,Beyond the Red Notebook: Essays on Paul Auster,Dennis Barone,4.14,14.0,,224.0,Paperback,,"20th Century, Reference, Nonfiction"
445,Paul Auster: Gravité et légèreté de l&apos;écriture,François Gavillon,4.25,4.0,,211.0,Paperback,,
446,Collapse: How Societies Choose to Fail or Succeed,Jared Diamond,3.93,73697.0,3907.0,608.0,Paperback,"Royal Society Science Book Prize (2006), California Book Award Nonfiction (Silver) (2005), Prix du livre sur l&apos;environnement (2007)","History, Nonfiction, Science, Anthropology, Sociology, Politics, Environment"
447,The Coming Economic Collapse: How You Can Thrive When Oil Costs $200 a Barrel,"Stephen Leeb, Glen Strathy",3.43,270.0,30.0,224.0,Hardcover,,"Economics, Nonfiction, Business, Finance, Politics, Peak Oil, Audiobook"
448,The Collapse of Complex Societies,Joseph A. Tainter,4.15,1435.0,182.0,264.0,Paperback,,"History, Nonfiction, Politics, Anthropology, Sociology, Economics, Science"
449,Bowling Alone: The Collapse and Revival of American Community,Robert D. Putnam,3.85,8515.0,1049.0,544.0,Paperback,,"Nonfiction, Sociology, Politics, History, Psychology, Social Science, Cultural"
450,The Collapse of Evolution,Scott M. Huse,4.01,106.0,11.0,224.0,Paperback,,"Christian, Science, Nonfiction, Evolution, Theology, Christianity"
451,Collapse of Burning Buildings : A Guide to Fireground Safety (Study Guide),Vincent Dunn,4.42,59.0,2.0,150.0,Paperback,,
452,The Collapse of the Common Good: How America&apos;s Lawsuit Culture Undermines Our Freedom,Philip K. Howard,3.97,73.0,4.0,268.0,Paperback,,"Nonfiction, Law, Politics"
453,"Armageddon Averted: The Soviet Collapse, 1970-2000",Stephen Kotkin,3.79,1378.0,146.0,245.0,Paperback,,"History, Russia, Nonfiction, Politics, Russian History, Soviet Union, European History"
454,Reinventing the Enemy&apos;s Language: Contemporary Native Women&apos;s Writings of North America,"Gloria Bird, Joy Harjo",4.4,353.0,30.0,578.0,Paperback,Gustavus Myers Outstanding Book Award (2000),"Poetry, Indigenous, Native American, Fiction, Short Stories, Anthologies, Literature"
455,The Languages of Native North America (Cambridge Language Surveys),Marianne Mithun,4.51,35.0,6.0,796.0,Paperback,,"Linguistics, Language, Indigenous, Native American, Reference, Nonfiction"
456,Searching for Lost City: On the Trail of America&apos;s Native Languages,Elizabeth Seay,4.0,13.0,2.0,272.0,Hardcover,,
457,Indian Sign Language (Native American),William Tomkins,4.05,60.0,5.0,128.0,Paperback,,"History, Language, Nonfiction, Linguistics, Native American, Reference"
458,Along the Clipper Way,Francis Chichester,4.0,48.0,7.0,304.0,Mass Market Paperback,,"Nonfiction, History"
459,Along the Clipper Way,Francis Chichester,4.0,48.0,7.0,287.0,Mass Market Paperback,,"Nonfiction, History"
460,"The Life and Adventures of John Nicol, Mariner","John Nicol, Tim Flannery",4.1,136.0,18.0,208.0,Hardcover,,"History, Biography, Memoir, Nonfiction, Travel, Maritime, Adventure"
461,The Fantastic Inventions of Nikola Tesla,"Nikola Tesla, David Hatcher Childress",4.03,284.0,22.0,324.0,Paperback,,"Science, Nonfiction, History, Biography, Engineering, Technology, Paranormal"
462,My Inventions,Nikola Tesla,3.91,12393.0,1007.0,88.0,Paperback,,"Biography, Science, Nonfiction, History, Autobiography, Physics, Memoir"
463,Wizard: The Life and Times of Nikola Tesla: Biography of a Genius,"Marc J. Seifer, William H. Terbo",3.73,6412.0,560.0,542.0,Paperback,,"Biography, Nonfiction, Science, History, Audiobook, Biography Memoir, Physics"
464,"Nikola Tesla: Colorado Springs Notes, 1899-1900",Nikola Tesla,4.07,30.0,1.0,439.0,Hardcover,,"Science, History, Nonfiction"
465,The Lost Journals of Nikola Tesla: HAARP - Chemtrails and the Secret of Alternative 4,Tim R. Swartz,4.07,60.0,6.0,168.0,Paperback,,"Nonfiction, Science, Biography"
466,Nikola Tesla: A Spark of Genius (Lerner Biographies),Carol Dommermuth-Costa,4.02,117.0,8.0,144.0,Library Binding,,"Biography, Science, History, Nonfiction"
467,The Tesla Papers: Nikola Tesla on Free Energy &amp; Wireless Transmission of Power,"Nikola Tesla, David Hatcher Childress",4.18,116.0,2.0,100.0,Paperback,,"Science, Technology, Biography, Nonfiction, History"
468,21st Century Mysteries: Nikola Tesla: Federal Documents and References (CD-ROM),U.S. Government,5.0,2.0,,23931.0,CD-ROM,,
469,Problem of Increasing Human Energy,Nikola Tesla,4.2,497.0,45.0,112.0,Paperback,,"Science, Nonfiction, Physics, Philosophy, Technology, Health, Biography"
470,The Tesla Rotating Magnetic Field,"Thomas Commerford Martin, Nikola Tesla",4.0,3.0,,48.0,Paperback,,
471,Art Invention House,Michael Webb,3.92,12.0,,320.0,Hardcover,,
472,How Invention Begins: Echoes of Old Voices in the Rise of New Machines,John H. Lienhard,3.9,21.0,3.0,288.0,Hardcover,,"Nonfiction, History"
473,The Invention of Peace: Reflections on War and International Order,Michael Eliot Howard,3.65,156.0,14.0,128.0,Hardcover,,"History, Politics, Nonfiction, Military Fiction, School, War, Philosophy"
474,The Invention of Tradition,"Eric J. Hobsbawm, Terence Ranger, Hugh Trevor-Roper, Prys Morgan, David Cannadine, Bernard S. Cohn",3.95,1514.0,108.0,320.0,Paperback,,"History, Nonfiction, Anthropology, Sociology, Politics, Philosophy, Theory"
475,The Story of Inventions,"Frank Puterbaugh Bachman, Michael J. McHugh",3.91,90.0,4.0,354.0,Paperback,,"Science, History, Nonfiction, School"
476,Amazing Leonardo da Vinci Inventions: You Can Build Yourself,Maxine Anderson,3.93,123.0,18.0,128.0,Paperback,,"Science, Art, Nonfiction, History, Biography, Childrens, Education"
477,The Complete Idiot&apos;s Guide to Cashing in On Your Inventions,Richard C. Levy,3.75,12.0,1.0,359.0,Paperback,,Business
478,The Invention of Love,Tom Stoppard,3.99,2284.0,165.0,112.0,Paperback,,"Plays, Drama, Fiction, Theatre, LGBT, Historical Fiction, Classics"
479,Sliding Into Home,Dori Hillestad Butler,3.99,106.0,24.0,224.0,Paperback,,"Sports, Fiction, Realistic Fiction"
480,Boys of Summer,"Julie Elizabeth Leto, Leslie Kelly, Kimberly Raye",3.77,502.0,18.0,256.0,Mass Market Paperback,,"Romance, Sports, Contemporary Romance, Harlequin Blaze, Sports Romance, Harlequin, Anthologies"
481,"When Johnny Came Sliding Home: The Post-Civil War Baseball Boom, 1865-1870",William J. Ryczek,4.5,10.0,1.0,323.0,Paperback,,Baseball
482,Sliding For Home,Frank Moher,1.0,1.0,1.0,118.0,Paperback,,
483,Sliding Home,Ray Holan,5.0,1.0,1.0,,binding,,
484,Programming Ruby: The Pragmatic Programmers&apos; Guide,"Dave         Thomas, Chad Fowler, Andy   Hunt",4.04,1984.0,71.0,829.0,Paperback,,"Programming, Technology, Reference, Nonfiction, Computers, Computer Science, Technical"
485,Programming Ruby: A Pragmatic Programmer&apos;s Guide,"Dave         Thomas, Andrew Hunt",4.04,1984.0,71.0,564.0,Paperback,,"Programming, Technology, Reference, Nonfiction, Computers, Computer Science, Technical"
486,Best of Ruby Quiz,James Edward Gray II,3.38,26.0,,176.0,Paperback,,Programming
487,From Java to Ruby: Things Every Manager Should Know (Pragmatic Programmers),Bruce A. Tate,3.2,30.0,3.0,160.0,Paperback,,Programming
488,Rails Recipes,Chad Fowler,3.54,313.0,7.0,332.0,Paperback,,"Programming, Software, Reference, Technical, Nonfiction, Technology, Web"
489,Learn to Program,Chris  Pine,4.13,546.0,56.0,149.0,Paperback,,"Programming, Nonfiction, Reference, Technology, Coding, Software, Computers"
490,"No Fluff, Just Stuff Anthology: The 2006 Edition",Neal Ford,3.38,26.0,1.0,240.0,Paperback,,"Programming, Technology"
491,English-Cayuga/Cayuga-English Dictionary,"Frances Froman, Lottie Keye, Alfred J. Keye",5.0,1.0,1.0,750.0,Hardcover,,
492,Golding&apos;s Lord of the Flies (Cliffs Notes),Maureen Kelly,3.98,122.0,10.0,112.0,Paperback,,"Reference, Nonfiction"
493,Lord of the Flies,William Golding,3.7,3099094.0,63344.0,6.0,Audio CD,,"Fiction, Classics, Young Adult, School, Dystopia, Literature, Read For School"
494,Lord of the Flies,"William Golding, Ben Gibson, E.M. Forster, Edmund L. Epstein",3.7,3099094.0,63344.0,315.0,Hardcover,,"Fiction, Classics, Young Adult, School, Dystopia, Literature, Read For School"
495,Lord of the Flies,"William Golding, James Robert Baker, Arthur P. Ziegler",3.7,3099094.0,63344.0,291.0,Paperback,,"Fiction, Classics, Young Adult, School, Dystopia, Literature, Read For School"
496,Cliffs Notes on Golding&apos;s Lord of the Flies,"Maureen Kelly, James Lamar Roberts, Gary Carey, Denis M. Calandra",3.98,122.0,10.0,72.0,Paperback,,"Reference, Nonfiction"
497,Lord of the Flies (SparkNotes Literature Guides),"SparkNotes, William Golding",3.85,67.0,8.0,72.0,Paperback,,"Reference, Fiction"
498,Lord of the Flies Activity Pack,James      Scott,5.0,1.0,,144.0,Spiral-bound,,
499,Lord of the Flies,"William Golding, Tim Pigott-Smith",3.7,3099094.0,63344.0,3.0,Audio CD,,"Fiction, Classics, Young Adult, School, Dystopia, Literature, Read For School"
500,A War Like No Other: How the Athenians &amp; Spartans Fought the Peloponnesian War,Victor Davis Hanson,4.13,3030.0,223.0,416.0,Paperback,,"History, Nonfiction, Ancient History, War, Military History, Greece, Military Fiction"
501,Jack: A Life Like No Other,Geoffrey Perrett,3.87,250.0,29.0,480.0,Hardcover,,"Biography, Nonfiction, History, Politics, American History, Presidents"
502,Like No Other,Robert Mercer-Nairne,3.75,4.0,,400.0,Hardcover,,
503,We Were Not Like Other People (English and Russian Edition),"Ephraim Sevela, Antonina W. Bouis",4.17,18.0,2.0,216.0,Library Binding,,
504,Brandy Station: A Battle Like None Other,Richard E. Crouch,3.0,1.0,,296.0,Hardcover,,
505,The Lovely Bones,Alice Sebold,3.86,2433619.0,48711.0,327.0,Paperback,"Bram Stoker Award Best First Novel (2002), Orange Prize Fiction Longlist (2003), British Book Award Best Read of the Year (2004), Book Sense Book of the Year Award Adult Fiction (2003), California Book Award First Fiction (Silver) (2002), South Carolina Book Award Young Adult Book Award (2005), Chicago Tribune Heartland Prize Fiction (2002), Iowa High School Book Award (2005), Puddly Award Fiction (2003), Eliot Rosewater Indiana High School Book Award (2005), Lincoln Award (2005), Gateway Readers Award (2005)","Fiction, Mystery, Young Adult, Contemporary, Fantasy, Thriller, Crime"
506,The Lovely Bones,Alice Sebold,3.86,2433619.0,48711.0,328.0,Paperback,"Bram Stoker Award Best First Novel (2002), Orange Prize Fiction Longlist (2003), British Book Award Best Read of the Year (2004), Book Sense Book of the Year Award Adult Fiction (2003), California Book Award First Fiction (Silver) (2002), South Carolina Book Award Young Adult Book Award (2005), Chicago Tribune Heartland Prize Fiction (2002), Iowa High School Book Award (2005), Puddly Award Fiction (2003), Eliot Rosewater Indiana High School Book Award (2005), Lincoln Award (2005), Gateway Readers Award (2005)","Fiction, Mystery, Young Adult, Contemporary, Fantasy, Thriller, Crime"
507,The Lovely Bones,Alice Sebold,3.86,2433619.0,48711.0,527.0,Paperback,"Bram Stoker Award Best First Novel (2002), Orange Prize Fiction Longlist (2003), British Book Award Best Read of the Year (2004), Book Sense Book of the Year Award Adult Fiction (2003), California Book Award First Fiction (Silver) (2002), South Carolina Book Award Young Adult Book Award (2005), Chicago Tribune Heartland Prize Fiction (2002), Iowa High School Book Award (2005), Puddly Award Fiction (2003), Eliot Rosewater Indiana High School Book Award (2005), Lincoln Award (2005), Gateway Readers Award (2005)","Fiction, Mystery, Young Adult, Contemporary, Fantasy, Thriller, Crime"
508,"Lovely in Her Bones (Elizabeth MacPherson, #2)",Sharyn McCrumb,3.82,1740.0,71.0,224.0,Mass Market Paperback,,"Mystery, Fiction, Cozy Mystery, Mystery Thriller, Cozy, Archaeology, Humor"
509,How to Invest in Self-Storage,"Scott  Duffy, R.K. Kliebenstein",4.2,10.0,,106.0,Paperback,,
510,USB Mass Storage: Designing and Programming Devices and Embedded Hosts,Jan Axelson,3.57,7.0,1.0,287.0,Paperback,,
511,Storage Area Networks for Dummies,"Christopher Poelker, Alex Nikitin",3.77,77.0,5.0,432.0,Paperback,,Programming
512,Storage Network Performance Analysis,Huseyin Simitci,3.86,14.0,,436.0,Paperback,,
513,Complete Home Storage (Sunset),"Barbara Braasch, Lisa Stockwell Kessler",3.18,11.0,,192.0,Paperback,,
514,Taunton&apos;s Home Storage Idea Book (Taunton Home Idea Books),"Joanne Kellar Bouknight, Stephanie Ramp, Christine Erikson",3.68,22.0,3.0,192.0,Paperback,,"Reference, Nonfiction"
515,Storage Area Network Essentials,"Richard    Barker, Paul Massiglia",4.19,16.0,1.0,532.0,Paperback,,
516,Perfect Order: Simple Storage Solutions,"Elizabeth Hilliard, Ray Main, Laura Hodgson",3.6,5.0,,160.0,Hardcover,,
517,Country Living Stylish Storage: Simple Ways to Contain Your Clutter,Paige Gilchrist,3.0,1.0,,144.0,Paperback,,
518,Simple Handmade Storage: 23 Step-By-Step Weekend Projects,"Kate Haxell, Philip Haxell",3.5,8.0,1.0,128.0,Paperback,,Crafts
519,Simple Storage Solutions,"Elizabeth Hilliard, Ray Main, Laura Hodgson",,,,160.0,Paperback,,
520,Storage (Chic Simple) (Chic Simple Components),"Jennifer Lisle, James Wojcik",3.38,8.0,,103.0,Hardcover,,
521,Simple Handmade Storage,"Philip Haxell, Kate Haxell",3.67,3.0,,128.0,Hardcover,,
522,"The Modern Gentleman: A Guide to Essential Manners, Savvy &amp; Vice","Phineas Mollod, Jason Tesauro",3.8,403.0,43.0,352.0,Paperback,,"Nonfiction, Self Help, Humor, Reference, Fashion"
523,The Chap Manifesto: Revolutionary Etiquette for the Modern Gentleman,"Gustav Temple, Vic Darkwood",3.96,92.0,8.0,144.0,Hardcover,,Humor
524,The Compleat Gentleman: The Modern Man&apos;s Guide to Chivalry,Brad Miner,3.66,281.0,32.0,264.0,Hardcover,,"Nonfiction, Philosophy, Self Help, Audiobook, Chivalry, Cultural, Reference"
525,The Last Gentleman (Modern Library),"Walker Percy, Robert Coles",3.81,2642.0,205.0,442.0,Hardcover,National Book Award Finalist Fiction (1967),"Fiction, Literature, Classics, Southern, Novels, Literary Fiction, American"
526,The Compleat Gentleman: The Modern Man&apos;s Guide to Chivalry (Audiofy Digital Audiobook Chips),"Brad Miner, Christopher Lane",3.66,281.0,32.0,0.0,Cards,,"Nonfiction, Philosophy, Self Help, Audiobook, Chivalry, Cultural, Reference"
527,The Compleat Gentleman: The Modern Man&apos;s Guide to Chivalry,"Brad Miner, Christopher Lane",3.66,281.0,32.0,0.0,Audio CD,,"Nonfiction, Philosophy, Self Help, Audiobook, Chivalry, Cultural, Reference"
528,The Word of a Gentleman: Meditations for Modern Man,Richard C. Halverson,3.0,1.0,,208.0,Paperback,,
529,The Colored Gentleman: A Product of Modern Civilization,Dennis Imbert,,,,86.0,Hardcover,,
530,CSS Mastery: Advanced Web Standards Solutions,"Andy Budd, Cameron Moll, Simon Collison, Dan Cederholm",4.09,1112.0,46.0,280.0,Paperback,,"Programming, Design, Website Design, Technology, Nonfiction, Web, Reference"
531,Head First Html With CSS &amp; XHTML,"Elisabeth Robson, Eric Freeman, Elisabeth Freeman",4.17,1376.0,141.0,702.0,Paperback,,"Programming, Nonfiction, Website Design, Technical, Reference, Technology, Computer Science"
532,The Zen of CSS Design: Visual Enlightenment for the Web,"Dave Shea, Molly E. Holzschlag",4.0,870.0,33.0,296.0,Paperback,,"Design, Website Design, Nonfiction, Technology, Web, Reference, Computers"
533,Stylin&apos; With CSS: A Designer&apos;s Guide,Charles Wyke-Smith,3.74,171.0,16.0,275.0,Paperback,,"Website Design, Design, Programming, Reference, Nonfiction, Technical, Technology"
534,CSS Pocket Reference,Eric A. Meyer,3.97,436.0,16.0,128.0,Paperback,,"Reference, Website Design, Programming, Nonfiction, Technology, Technical, Computers"
535,"The CSS Anthology: 101 Essential Tips, Tricks &amp; Hacks","Rachel Andrew, Simon Willison",3.93,228.0,19.0,376.0,Paperback,,"Programming, Reference, Website Design, Web, Technology, Design, Computer Science"
536,HTML Utopia: Designing Without Tables Using CSS,"Rachel Andrew, Daniel Shafer",3.55,55.0,7.0,520.0,Paperback,,"Programming, Web, Computers, Technical"
537,"HTML, XHTML &amp; CSS (Visual Quickstart Guide)",Elizabeth Castro,3.81,592.0,39.0,456.0,Paperback,,"Nonfiction, Reference, Website Design, Computers, Programming, Technology, Design"
538,Eric Meyer on CSS: Mastering the Language of Web Design,Eric A. Meyer,4.15,310.0,17.0,350.0,Paperback,,"Reference, Website Design, Programming, Web, Technology, Nonfiction, Design"
539,"1,000 Places to See in the USA and Canada Before You Die",Patricia Schultz,4.05,2700.0,108.0,1183.0,Paperback,,"Travel, Nonfiction, Reference, Canada, History, Guidebook, Americana"
540,Clotted Cream,Carolyn Martin,,,,32.0,Paperback,,
541,1000 Cornish Place Names Explained,Julyan Holmes,3.0,1.0,,40.0,Paperback,,
542,Michelin Charming Places to Stay 2003: 1000 Hotels &amp; Guesthouses in France for Less than 80 €,Guides Touristiques Michelin,3.17,6.0,,584.0,Paperback,,Travel
543,1000 Record Covers,Michael Ochs,3.9,683.0,69.0,575.0,Hardcover,,"Nonfiction, Reference, Design, Photography, Collections, History, Art Design"
544,Record Covers,"Paul Huf, Leo Boudewijns",,,,120.0,Paperback,,
